{
  "manifest_version": "1.0.0",
  "generated_at": "2026-08-31",
  "corpus": {
    "include_roots": [
      ".",
      "adr",
      "adapters",
      "acceptance",
      "benchmark",
      "contracts",
      "discipline-packs",
      "docs",
      "evals",
      "examples",
      "governance",
      "releases",
      "reviewer-packs",
      "schemas",
      "skills",
      "tasks",
      "specs",
      ".specify/memory"
    ],
    "include_files": [
      "LICENSE"
    ],
    "exclude_prefixes": [
      ".agents",
      ".github",
      "tests",
      "dogfood",
      "acceptance/portability/evidence",
    "benchmark/artifacts/raw-evidence-v0.2",
    "G1-M1-SELF-HEALING-ENGINE-FINAL-BUILDER-REPORT.md",
    "M1-SELF-HEALING-ENGINE-BUILDER-REPORT.md",
    ".specify/templates",
      ".specify/scripts",
      ".specify/integrations"
    ]
  },
  "source_inputs": [
    {
      "filename": "SWOS_Roadmap_and_Implementation_Plan.md",
      "sha256": "c901379801190991c1a9ef1465b62c6aca51620d297b3b73b8cd8d37393dd7a9",
      "date": "2026-08-29",
      "role": "research_input",
      "derived_canonical_documents": [
        "swos-vision",
        "docs-roadmap",
        "specs-001-swos-v1-1-programme-foundation-spec-md"
      ]
    },
    {
      "filename": "SWOS_Strategic_Roadmap.docx",
      "sha256": "2d1088b8b7b713237b2e4bdb74d78137a4d3899a6c2322656b686717fe949bef",
      "date": "2026-08-29",
      "role": "research_input",
      "derived_canonical_documents": [
        "swos-vision",
        "docs-roadmap"
      ]
    },
    {
      "filename": "Research on Enterprise-Grade Writing Skills.docx",
      "sha256": "678deda54c55387ae500deea4e4bcb9eac8d01850ff23e07cc2798ab43fbd9eb",
      "date": "2026-08-29",
      "role": "research_input",
      "derived_canonical_documents": [
        "swos-vision",
        "swos-constitution",
        "docs-roadmap"
      ]
    }
  ],
  "documents": [
    {
      "id": "swos-constitution",
      "path": ".specify/memory/constitution.md",
      "title": "SWOS Constitution",
      "owner": "SWOS Maintainers",
      "authority": "constitutional",
      "status": "active",
      "version_scheme": "living",
      "version": "current",
      "canonical_for": [
        "document-swos-constitution"
      ],
      "supersedes": [],
      "superseded_by": []
    },
    {
      "id": "baseline-report-md",
      "path": "BASELINE_REPORT.md",
      "title": "SWOS 100% Completion Baseline Report",
      "owner": "SWOS Maintainers",
      "authority": "historical",
      "status": "historical",
      "version_scheme": "date",
      "version": "2026-08-23",
      "canonical_for": [
        "document-baseline-report-md"
      ],
      "supersedes": [],
      "superseded_by": []
    },
    {
      "id": "changelog-md",
      "path": "CHANGELOG.md",
      "title": "Changelog",
      "owner": "SWOS Maintainers",
      "authority": "informative",
      "status": "active",
      "version_scheme": "living",
      "version": "current",
      "canonical_for": [
        "document-changelog-md"
      ],
      "supersedes": [],
      "superseded_by": []
    },
    {
      "id": "code-of-conduct-md",
      "path": "CODE_OF_CONDUCT.md",
      "title": "Code of Conduct",
      "owner": "SWOS Maintainers",
      "authority": "governance",
      "status": "active",
      "version_scheme": "living",
      "version": "current",
      "canonical_for": [
        "document-code-of-conduct-md"
      ],
      "supersedes": [],
      "superseded_by": []
    },
    {
      "id": "contributing-md",
      "path": "CONTRIBUTING.md",
      "title": "Contributing to SWOS",
      "owner": "SWOS Maintainers",
      "authority": "informative",
      "status": "active",
      "version_scheme": "living",
      "version": "current",
      "canonical_for": [
        "document-contributing-md"
      ],
      "supersedes": [],
      "superseded_by": []
    },
    {
      "id": "g-prose95-final-builder-report-md",
      "path": "G-PROSE95-FINAL-BUILDER-REPORT.md",
      "title": "G-Prose95 Final Builder Report",
      "owner": "SWOS Maintainers",
      "authority": "historical",
      "status": "historical",
      "version_scheme": "date",
      "version": "2026-08-23",
      "canonical_for": [
        "document-g-prose95-final-builder-report-md"
      ],
      "supersedes": [],
      "superseded_by": []
    },
    {
      "id": "governance-md",
      "path": "GOVERNANCE.md",
      "title": "Project Governance",
      "owner": "SWOS Maintainers",
      "authority": "governance",
      "status": "active",
      "version_scheme": "living",
      "version": "current",
      "canonical_for": [
        "document-governance-md"
      ],
      "supersedes": [],
      "superseded_by": []
    },
    {
      "id": "license",
      "path": "LICENSE",
      "title": "License",
      "owner": "SWOS Maintainers",
      "authority": "governance",
      "status": "active",
      "version_scheme": "living",
      "version": "current",
      "canonical_for": [
        "document-license"
      ],
      "supersedes": [],
      "superseded_by": []
    },
    {
      "id": "progress-md",
      "path": "PROGRESS.md",
      "title": "SWOS engineering progress",
      "owner": "SWOS Maintainers",
      "authority": "operational",
      "status": "active",
      "version_scheme": "living",
      "version": "current",
      "canonical_for": [
        "document-progress-md"
      ],
      "supersedes": [],
      "superseded_by": []
    },
    {
      "id": "root-readme",
      "path": "README.md",
      "title": "SWOS - Scholarly Writing Operating System",
      "owner": "SWOS Maintainers",
      "authority": "informative",
      "status": "active",
      "version_scheme": "living",
      "version": "current",
      "canonical_for": [
        "document-root-readme"
      ],
      "supersedes": [],
      "superseded_by": []
    },
    {
      "id": "security-md",
      "path": "SECURITY.md",
      "title": "Security Policy",
      "owner": "SWOS Maintainers",
      "authority": "governance",
      "status": "active",
      "version_scheme": "living",
      "version": "current",
      "canonical_for": [
        "document-security-md"
      ],
      "supersedes": [],
      "superseded_by": []
    },
    {
      "id": "swos-solution-architecture-md",
      "path": "SWOS-Solution-Architecture.md",
      "title": "SWOS — Scholarly Writing Operating System",
      "owner": "SWOS Maintainers",
      "authority": "informative",
      "status": "active",
      "version_scheme": "living",
      "version": "current",
      "canonical_for": [
        "document-swos-solution-architecture-md"
      ],
      "supersedes": [],
      "superseded_by": []
    },
    {
      "id": "swos-vision",
      "path": "VISION.md",
      "title": "SWOS Vision",
      "owner": "SWOS Maintainers",
      "authority": "normative",
      "status": "active",
      "version_scheme": "living",
      "version": "current",
      "canonical_for": [
        "document-swos-vision"
      ],
      "supersedes": [],
      "superseded_by": []
    },
    {
      "id": "acceptance-portability-readme-md",
      "path": "acceptance/portability/README.md",
      "title": "SWOS v2 Portability Acceptance",
      "owner": "SWOS Maintainers",
      "authority": "operational",
      "status": "active",
      "version_scheme": "living",
      "version": "current",
      "canonical_for": [
        "document-acceptance-portability-readme-md"
      ],
      "supersedes": [],
      "superseded_by": []
    },
    {
      "id": "adapters-readme-md",
      "path": "adapters/README.md",
      "title": "Host Adapters",
      "owner": "SWOS Maintainers",
      "authority": "normative",
      "status": "active",
      "version_scheme": "living",
      "version": "current",
      "canonical_for": [
        "document-adapters-readme-md"
      ],
      "supersedes": [],
      "superseded_by": []
    },
    {
      "id": "adapters-agent-skills-readme-md",
      "path": "adapters/agent-skills/README.md",
      "title": "Agent Skills Adapter (reference)",
      "owner": "SWOS Maintainers",
      "authority": "normative",
      "status": "active",
      "version_scheme": "living",
      "version": "current",
      "canonical_for": [
        "document-adapters-agent-skills-readme-md"
      ],
      "supersedes": [],
      "superseded_by": []
    },
    {
      "id": "adapters-claude-code-readme-md",
      "path": "adapters/claude-code/README.md",
      "title": "Claude Code adapter",
      "owner": "SWOS Maintainers",
      "authority": "normative",
      "status": "active",
      "version_scheme": "living",
      "version": "current",
      "canonical_for": [
        "document-adapters-claude-code-readme-md"
      ],
      "supersedes": [],
      "superseded_by": []
    },
    {
      "id": "adapters-cli-readme-md",
      "path": "adapters/cli/README.md",
      "title": "CLI Adapter",
      "owner": "SWOS Maintainers",
      "authority": "normative",
      "status": "active",
      "version_scheme": "living",
      "version": "current",
      "canonical_for": [
        "document-adapters-cli-readme-md"
      ],
      "supersedes": [],
      "superseded_by": []
    },
    {
      "id": "adapters-codex-readme-md",
      "path": "adapters/codex/README.md",
      "title": "Codex adapter",
      "owner": "SWOS Maintainers",
      "authority": "normative",
      "status": "active",
      "version_scheme": "living",
      "version": "current",
      "canonical_for": [
        "document-adapters-codex-readme-md"
      ],
      "supersedes": [],
      "superseded_by": []
    },
    {
      "id": "adapters-ide-readme-md",
      "path": "adapters/ide/README.md",
      "title": "IDE Agent Adapter",
      "owner": "SWOS Maintainers",
      "authority": "normative",
      "status": "active",
      "version_scheme": "living",
      "version": "current",
      "canonical_for": [
        "document-adapters-ide-readme-md"
      ],
      "supersedes": [],